{"apiVersion":"purview-governance-plan/v2","changeSet":{"items":[]},"configurationApiVersion":"purview-governance-config/v2","desiredState":{"dataSources":[],"scanRuleSets":[],"scans":[]},"executionEligibility":"ready","identities":{"desiredState":"sha256:7f056b3b6c9eabbae045eaf92ff38e7fc56cf2d527e03398863472d6a3c05ed1","materialConfiguration":"sha256:b614f5b219618c1e30f1c4ed921120d8d77edaa1f4ba0f8a1dd8df20821b0c27","remoteState":"sha256:ed32ed4f06fed9324b73ed1fe7f6fc1770e264a6bba03e853d1684978c27294c"},"operations":[],"planIdentity":"sha256:7bdae868a6ba0bed0a22bc632e41c2bdc696bcf17d09c4e535c644a74012f1ff","summary":{"blocked":0,"create":0,"noOp":0,"operations":0,"remoteOnly":0,"replace":0,"total":0},"targetContext":{"endpoint":"https://account.purview.azure.com","identity":"sha256:c9b4b7edbace1c47a6c609b8db3852924c5c0cca459743c7632e3fba8e035efe"}}
